project_ID,title,summary
prj06,Himalaya Fly,facere cupiditate nobis ab animi consectetur error numquam officia ullam velit iure natus temporibus quod praesentium voluptate magni voluptatum a rem amet eaque voluptatem laborum qui hic dolorem sequi dolor placeat aut sed eveniet expedita possimus distinctio consequatur dolores maiores id accusantium ducimus mollitia quidem at provident ad adipisci odit libero voluptates quo reprehenderit aliquam beatae perferendis fugiat ipsa corporis quae recusandae ipsam debitis necessitatibus repellendus labore culpa nisi atque exercitationem excepturi quasi illum molestias tempore non odio in repudiandae repellat est modi accusamus
prj08,Illumino Eye,sint ipsa cum laudantium repellendus eius doloribus minus autem corrupti odit perferendis illum est nam quae dignissimos ratione facere numquam cumque dolore voluptatibus voluptate voluptatem possimus maxime quia accusamus magni rem repudiandae repellat assumenda aperiam exercitationem nisi quo amet reprehenderit provident eaque culpa similique neque beatae iusto ipsum aut deserunt omnis impedit rerum dolorem iure dolorum enim veritatis sed hic ut nulla quibusdam cupiditate a ducimus debitis consequuntur nesciunt optio voluptates porro officia fuga velit earum suscipit eum fugit reiciendis commodi laborum quis itaque praesentium dolores voluptatum quisquam ea delectus quos architecto adipisci libero placeat
prj02,Hades,consequatur explicabo ducimus fugit similique a natus laborum porro odio iusto vel in illum sint autem esse est cumque quo itaque unde incidunt molestiae hic totam tempore libero eaque culpa voluptate reiciendis quisquam cum consectetur sunt tenetur enim animi impedit facilis ipsa accusamus quibusdam fuga possimus ad vero nesciunt modi debitis quas nobis fugiat mollitia saepe quidem temporibus expedita quis dolorum iure iste voluptas officia aspernatur ab id veritatis repellendus ea minima optio quasi inventore corporis voluptatem officiis quaerat doloremque sapiente qui
prj23,Instant Galaxy,odit molestias obcaecati voluptatem dolor ut cupiditate accusamus omnis quasi facilis totam tenetur id cumque sint nulla neque autem labore ea iusto expedita a deserunt beatae nihil fugiat eum laborum ipsum non magnam atque dolores natus quae eligendi iste nostrum laudantium perspiciatis similique fugit aperiam illum quo numquam dolorum voluptates rerum amet vitae nisi et quisquam quaerat rem dolore nemo harum sunt consequuntur eius veritatis dolorem quibusdam blanditiis odio sit impedit voluptatum aut inventore unde commodi error illo veniam asperiores explicabo mollitia repellat recusandae earum pariatur
prj15,Indie Profilers,amet fugiat fuga sequi ad eius magni quidem tenetur voluptatibus eos sunt vel consequuntur perspiciatis quas eveniet commodi consequatur vitae asperiores ipsum natus culpa at magnam hic rem cupiditate qui doloribus autem unde recusandae voluptatem beatae doloremque corrupti neque ipsam a temporibus pariatur veritatis exercitationem alias itaque quibusdam enim perferendis accusamus animi architecto incidunt non suscipit reprehenderit aliquid omnis voluptate quisquam minima quasi ipsa sed nobis error adipisci necessitatibus atque placeat illum velit sint dicta id rerum maxime voluptates provident soluta dignissimos odio maiores impedit molestiae delectus quis et dolor nihil explicabo eligendi voluptatum laudantium repudiandae facilis earum facere dolore nisi
prj17,The Coding Awards,veritatis nam beatae debitis recusandae soluta quas quam eveniet nulla veniam dicta molestiae exercitationem quos sunt dignissimos architecto numquam quod a fuga id deleniti distinctio inventore similique totam esse aliquid cumque in dolore ducimus aperiam quia unde nesciunt doloribus quidem ipsam error voluptas animi libero accusamus culpa expedita reprehenderit ullam earum dolor temporibus sequi sint maiores voluptatum optio aspernatur consequatur quasi quis asperiores molestias praesentium eligendi dolorem rem corporis fugit saepe explicabo vitae voluptatibus et nobis blanditiis consectetur facilis eum laudantium impedit repellat at cum quaerat alias sed provident itaque adipisci odit nihil illo voluptatem tempora labore voluptate
prj13,Great Marvell,molestiae repellendus sunt ratione cum fugit impedit eos numquam nulla aspernatur magni vitae suscipit quisquam et labore optio id eius excepturi reprehenderit beatae minus quo officia dicta consequatur dolor delectus a recusandae quos perspiciatis nemo reiciendis itaque accusamus dignissimos tempora totam perferendis est earum quas eum voluptatibus aut doloremque voluptates inventore nihil nesciunt vel consequuntur dolores quis voluptate consectetur incidunt alias iure quae blanditiis saepe enim atque expedita nam harum tenetur sit adipisci voluptas error ut fuga rerum sed corporis laborum unde repellat hic iusto
prj33,Yodha,quis enim deleniti illo harum illum deserunt temporibus iure eaque veritatis aut ipsum alias nesciunt repellendus doloribus eveniet minus facere omnis est eos nulla amet totam sunt a laborum nisi cupiditate ratione error iusto quibusdam autem quia ducimus blanditiis assumenda itaque eum accusantium rem qui culpa nobis laboriosam repudiandae optio officiis tenetur suscipit nihil vitae consectetur neque quos architecto dolor distinctio aspernatur quisquam nemo at provident unde earum ea quaerat consequuntur mollitia odio modi commodi impedit
prj11,Enter Coding,odit molestias obcaecati voluptatem dolor ut cupiditate accusamus omnis quasi facilis totam tenetur id cumque sint nulla neque autem labore ea iusto expedita a deserunt beatae nihil fugiat eum laborum ipsum non magnam atque dolores natus quae eligendi iste nostrum laudantium perspiciatis similique fugit aperiam illum quo numquam dolorum voluptates rerum amet vitae nisi et quisquam quaerat rem dolore nemo harum sunt consequuntur eius veritatis dolorem quibusdam blanditiis odio sit impedit voluptatum aut inventore unde commodi error illo veniam asperiores explicabo mollitia repellat recusandae earum pariatur
prj19,Odyssey,perferendis neque voluptas sapiente aliquam commodi adipisci dolor suscipit tenetur error repudiandae laboriosam modi itaque maxime natus molestiae numquam omnis magni optio consequuntur quasi explicabo ipsam magnam iste quae deleniti labore excepturi voluptate et alias nostrum eaque illum consequatur laudantium quo aspernatur eligendi soluta quibusdam ut ea nesciunt fugit accusamus consectetur repellendus accusantium officiis animi repellat amet provident minima libero reiciendis cupiditate quos minus asperiores facilis quas at temporibus voluptatum doloribus distinctio odit nisi quis similique placeat culpa fugiat praesentium inventore quaerat corrupti delectus cumque id vel maiores aperiam vitae expedita molestias iusto eveniet impedit ad beatae eos sit illo
